<!ELEMENT libros (libro+)>
<!ELEMENT libro (id,tipo_clase,paginas)>

<!-- Definimos los atributos del libro -->
<!ATTLIST libro id ID #REQUIRED>
<!ATTLIST libro tipo_clase (novela | infantil | didÃ¡ctico) #REQUIRED>
<!ATTLIST libro paginas CDATA #REQUIRED>

<!ELEMENT titulo (#PCDATA)>

<!ELEMENT capitulo (c_paginas)>
<!ATTLIST capitulo c_paginas CDATA >

<!ELEMENT titulo_capitulo (#PCDATA)>
<!ELEMENT contenido (#PCDATA)>
<!ATTLIST contenido enlace CDATA #REQUIRED>

<!ELEMENT indice (#PCDATA)>
<!ELEMENT sinopsis (#PCDATA)>

<!-- <!ENTITY entity name SYSTEM "URI/URL"> -->
